"Status","Start Time","Stop Time","Duration in ms","Parent Suite","Suite","Sub Suite","Test Class","Test Method","Name","Description"
"passed","Tue Dec 01 17:53:13 MSK 2020","Tue Dec 01 17:54:09 MSK 2020","55955","","Переводы SWIFT - интеграционные тесты","","Переводы SWIFT - интеграционные тесты","Выгрузка квитанции со страницы успешного перевода SWIFT (со счета)","Выгрузка квитанции со страницы успешного перевода SWIFT (со счета)",""
"skipped","Tue Dec 01 18:11:26 MSK 2020","Tue Dec 01 18:11:26 MSK 2020","0","","Интеграционные тесты входа в приложение","","Интеграционные тесты входа в приложение","Ошибка при входе по логину/паролю - блокировка при превышении попыток ввода неверного пароля","Ошибка при входе по логину/паролю - блокировка при превышении попыток ввода неверного пароля",""
"passed","Tue Dec 01 18:04:25 MSK 2020","Tue Dec 01 18:04:47 MSK 2020","22591","","Депозиты - Калькулятор - интеграционные тесты","","Депозиты - Калькулятор - интеграционные тесты","Пользователю отображается список вкладов установлены все условия","Пользователю отображается список вкладов установлены все условия",""
"failed","Tue Dec 01 18:25:17 MSK 2020","Tue Dec 01 18:25:38 MSK 2020","21427","","Блокировка карты временная - интеграционные тесты","","Блокировка карты временная - интеграционные тесты","Временная блокировка карты должна пройти успешно","Временная блокировка карты должна пройти успешно",""
"passed","Tue Dec 01 18:12:14 MSK 2020","Tue Dec 01 18:12:24 MSK 2020","9735","","Интеграционные тесты входа в приложение","","Интеграционные тесты входа в приложение","Ошибка при входе по продукту - не верный формат телефона","Ошибка при входе по продукту - не верный формат телефона",""
"failed","Tue Dec 01 18:00:22 MSK 2020","Tue Dec 01 18:02:28 MSK 2020","126126","","Открытие вклада Рустащий процент - интеграционные тесты","","Открытие вклада Рустащий процент - интеграционные тесты","Открытие вклада растущий процент в рублях","Открытие вклада растущий процент в рублях",""
"failed","Tue Dec 01 17:06:46 MSK 2020","Tue Dec 01 17:10:12 MSK 2020","206135","","PaymentForm - ЖКУ - integration tests","","PaymentForm - ЖКУ - integration tests","Выгрузка квитанции на email со страницы успешного оплаты ЖКУ (с карты)","Выгрузка квитанции на email со страницы успешного оплаты ЖКУ (с карты)",""
"failed","Tue Dec 01 18:05:53 MSK 2020","Tue Dec 01 18:06:14 MSK 2020","20765","","Депозиты - Калькулятор - интеграционные тесты","","Депозиты - Калькулятор - интеграционные тесты","Пользователю отображается список вкладов на основе набора параметров 2","Пользователю отображается список вкладов на основе набора параметров 2",""
"failed","Tue Dec 01 17:39:56 MSK 2020","Tue Dec 01 17:39:56 MSK 2020","45","","Переводы между своими счетами - интеграционные тесты","","Переводы между своими счетами - интеграционные тесты","Проверить в ленте операций отображение операции перевода Между своими счетами (со счета на карту) с конверсией","Проверить в ленте операций отображение операции перевода Между своими счетами (со счета на карту) с конверсией",""
"passed","Tue Dec 01 18:23:45 MSK 2020","Tue Dec 01 18:24:38 MSK 2020","53036","","Интеграционные тесты автоплатежей","","Интеграционные тесты автоплатежей","Создание бессрочного автоплатежа должно пройти успешно","Создание бессрочного автоплатежа должно пройти успешно",""
"passed","Tue Dec 01 18:23:07 MSK 2020","Tue Dec 01 18:23:45 MSK 2020","37373","","История операций - интеграционные тесты","","История операций - интеграционные тесты","Успешное открытие квитанции платежа","Успешное открытие квитанции платежа",""
"passed","Tue Dec 01 18:11:35 MSK 2020","Tue Dec 01 18:11:43 MSK 2020","8342","","Интеграционные тесты входа в приложение","","Интеграционные тесты входа в приложение","Ошибка при входе по продукту - без телефона","Ошибка при входе по продукту - без телефона",""
"skipped","Tue Dec 01 18:30:27 MSK 2020","Tue Dec 01 18:30:27 MSK 2020","0","","Проверка карточек продуктов-призраков по Вкладам","","Проверка карточек продуктов-призраков по Вкладам","Отказ от предложения с выбором причины ""Хочу другие условия""","Отказ от предложения с выбором причины ""Хочу другие условия""",""
"skipped","Tue Dec 01 18:11:26 MSK 2020","Tue Dec 01 18:11:26 MSK 2020","0","","Интеграционные тесты входа в приложение","","Интеграционные тесты входа в приложение","Ошибка при входе по логину/паролю - блокировка при превышении попыток ввода неверного кода подтверждения","Ошибка при входе по логину/паролю - блокировка при превышении попыток ввода неверного кода подтверждения",""
"passed","Tue Dec 01 17:20:05 MSK 2020","Tue Dec 01 17:21:47 MSK 2020","102750","","Переводы по номеру карты клиенту банка - интеграционные тесты","","Переводы по номеру карты клиенту банка - интеграционные тесты","Выгрузка квитанции со страницы успешного перевода Клиенту ОТП-банка по номеру карты (со счета)","Выгрузка квитанции со страницы успешного перевода Клиенту ОТП-банка по номеру карты (со счета)",""
"skipped","Tue Dec 01 18:30:27 MSK 2020","Tue Dec 01 18:30:27 MSK 2020","0","","ChangePhoneForm integration test","","ChangePhoneForm integration test","Смена номера телефона через email и повторная смена через телефон","Смена номера телефона через email и повторная смена через телефон",""
"passed","Tue Dec 01 18:03:43 MSK 2020","Tue Dec 01 18:04:03 MSK 2020","20583","","Депозиты - Калькулятор - интеграционные тесты","","Депозиты - Калькулятор - интеграционные тесты","Пользователю отображается список вкладов с возможностью частичного снятия","Пользователю отображается список вкладов с возможностью частичного снятия",""
"passed","Tue Dec 01 18:25:38 MSK 2020","Tue Dec 01 18:26:03 MSK 2020","24318","","Витрина карт","","Витрина карт","Проверка отсутствия выбора офиса и вывод ошибки при отсутствии офисов","Проверка отсутствия выбора офиса и вывод ошибки при отсутствии офисов",""
"passed","Tue Dec 01 17:41:52 MSK 2020","Tue Dec 01 17:44:33 MSK 2020","160344","","Переводы в другой банк физическим лицам - интеграционные тесты","","Переводы в другой банк физическим лицам - интеграционные тесты","Проверить в ленте операций отображение операции перевода В другой банк - Людям","Проверить в ленте операций отображение операции перевода В другой банк - Людям",""
"passed","Tue Dec 01 18:10:22 MSK 2020","Tue Dec 01 18:10:38 MSK 2020","15541","","Интеграционные тесты входа в приложение","","Интеграционные тесты входа в приложение","Успешный вход по продукту через карту/телефон","Успешный вход по продукту через карту/телефон",""
"passed","Tue Dec 01 18:15:33 MSK 2020","Tue Dec 01 18:15:45 MSK 2020","12100","","Интеграционные тесты нотификации смены паспортных данных Интеграционные тесты при наличии оффера","","Интеграционные тесты нотификации смены паспортных данных Интеграционные тесты при наличии оффера","Должен отображаться маркер нотификации возле кнопки сообщений","Должен отображаться маркер нотификации возле кнопки сообщений",""
"passed","Tue Dec 01 18:09:47 MSK 2020","Tue Dec 01 18:09:59 MSK 2020","12222","","Интеграционные тесты входа в приложение","","Интеграционные тесты входа в приложение","Успешный вход по логину/паролю","Успешный вход по логину/паролю",""
"failed","Tue Dec 01 17:10:12 MSK 2020","Tue Dec 01 17:13:36 MSK 2020","204332","","PaymentForm - ЖКУ - integration tests","","PaymentForm - ЖКУ - integration tests","Проверить в ленте операций отображение оплаты ЖКУ (с карты)","Проверить в ленте операций отображение оплаты ЖКУ (с карты)",""
"passed","Tue Dec 01 18:02:29 MSK 2020","Tue Dec 01 18:02:35 MSK 2020","5621","","Интеграционные тесты входа в приложение только для Firefox","","Интеграционные тесты входа в приложение только для Firefox","Вставка номера телефона из буфера обмена","Вставка номера телефона из буфера обмена",""
"passed","Tue Dec 01 17:13:37 MSK 2020","Tue Dec 01 17:14:00 MSK 2020","23268","","Переводы по номеру карты - интеграционные тесты","","Переводы по номеру карты - интеграционные тесты","Должна отображаться ошибка при вводе номера карты","Должна отображаться ошибка при вводе номера карты",""
"skipped","Tue Dec 01 18:30:27 MSK 2020","Tue Dec 01 18:30:27 MSK 2020","0","","ChangeEmailForm integration test","","ChangeEmailForm integration test","Установка email","Установка email",""
"passed","Tue Dec 01 18:02:35 MSK 2020","Tue Dec 01 18:02:56 MSK 2020","20795","","Депозиты - Калькулятор - интеграционные тесты","","Депозиты - Калькулятор - интеграционные тесты","Пользователю отображается список вкладов на основе выбранной валюты","Пользователю отображается список вкладов на основе выбранной валюты",""
"passed","Tue Dec 01 17:19:15 MSK 2020","Tue Dec 01 17:19:34 MSK 2020","19643","","Переводы по номеру карты клиенту банка - интеграционные тесты","","Переводы по номеру карты клиенту банка - интеграционные тесты","Должна отображаться ошибка при вводе номера карты","Должна отображаться ошибка при вводе номера карты",""
"passed","Tue Dec 01 18:03:22 MSK 2020","Tue Dec 01 18:03:43 MSK 2020","21210","","Депозиты - Калькулятор - интеграционные тесты","","Депозиты - Калькулятор - интеграционные тесты","Пользователю отображается список вкладов на основе суммы вклада","Пользователю отображается список вкладов на основе суммы вклада",""
"passed","Tue Dec 01 18:26:03 MSK 2020","Tue Dec 01 18:26:18 MSK 2020","15075","","Витрина карт","","Витрина карт","Просмотр витрины карт - витрина не пустая","Просмотр витрины карт - витрина не пустая",""
"passed","Tue Dec 01 18:22:30 MSK 2020","Tue Dec 01 18:22:41 MSK 2020","11260","","Бонусная система рыбки - баланс - интеграционные тесты Отображение 0 рыбок","","Бонусная система рыбки - баланс - интеграционные тесты Отображение 0 рыбок","Баланс должен быть 0","Баланс должен быть 0",""
"passed","Tue Dec 01 18:16:22 MSK 2020","Tue Dec 01 18:16:43 MSK 2020","21125","","Интеграционные тесты нотификации смены паспортных данных Интеграционные тесты при наличии оффера","","Интеграционные тесты нотификации смены паспортных данных Интеграционные тесты при наличии оффера","Должен успешно пройти подтверждение паспортных данных","Должен успешно пройти подтверждение паспортных данных",""
"passed","Tue Dec 01 16:58:04 MSK 2020","Tue Dec 01 17:00:03 MSK 2020","118191","","PaymentForm - Rapida - integration tests","","PaymentForm - Rapida - integration tests","Выгрузка квитанции на email успешной оплаты Мобильной связи Yota (со счета)","Выгрузка квитанции на email успешной оплаты Мобильной связи Yota (со счета)",""
"passed","Tue Dec 01 17:55:36 MSK 2020","Tue Dec 01 17:56:27 MSK 2020","51175","","Переводы SWIFT - интеграционные тесты","","Переводы SWIFT - интеграционные тесты","Проверить в ленте операций отображение операции перевода SWIFT (со счета)","Проверить в ленте операций отображение операции перевода SWIFT (со счета)",""
"passed","Tue Dec 01 18:15:45 MSK 2020","Tue Dec 01 18:16:03 MSK 2020","18259","","Интеграционные тесты нотификации смены паспортных данных Интеграционные тесты при наличии оффера","","Интеграционные тесты нотификации смены паспортных данных Интеграционные тесты при наличии оффера","Должен отображаться маркер нотификации возле раздела профиля Персональные сведения","Должен отображаться маркер нотификации возле раздела профиля Персональные сведения",""
"passed","Tue Dec 01 18:12:06 MSK 2020","Tue Dec 01 18:12:14 MSK 2020","7636","","Интеграционные тесты входа в приложение","","Интеграционные тесты входа в приложение","Ошибка при входе по продукту - не верный продукт/телефон","Ошибка при входе по продукту - не верный продукт/телефон",""
"passed","Tue Dec 01 18:24:55 MSK 2020","Tue Dec 01 18:25:16 MSK 2020","21497","","DocumentsCard integration tests","","DocumentsCard integration tests","Манипуляции с документом должны пройти успешно","Манипуляции с документом должны пройти успешно",""
"failed","Tue Dec 01 17:03:16 MSK 2020","Tue Dec 01 17:06:46 MSK 2020","209247","","PaymentForm - ЖКУ - integration tests","","PaymentForm - ЖКУ - integration tests","Выгрузка квитанции со страницы успешного оплаты ЖКУ (с карты)","Выгрузка квитанции со страницы успешного оплаты ЖКУ (с карты)",""
"passed","Tue Dec 01 17:56:57 MSK 2020","Tue Dec 01 17:57:25 MSK 2020","28315","","Открытие накопительного счета - интеграционные тесты","","Открытие накопительного счета - интеграционные тесты","Открытие накопительного счета в долларах с 0 долларов","Открытие накопительного счета в долларах с 0 долларов",""
"failed","Tue Dec 01 17:14:21 MSK 2020","Tue Dec 01 17:15:57 MSK 2020","95538","","Переводы по номеру карты - интеграционные тесты","","Переводы по номеру карты - интеграционные тесты","Успешный перевод с верифицированным номером телефона","Успешный перевод с верифицированным номером телефона",""
"passed","Tue Dec 01 18:16:03 MSK 2020","Tue Dec 01 18:16:22 MSK 2020","18692","","Интеграционные тесты нотификации смены паспортных данных Интеграционные тесты при наличии оффера","","Интеграционные тесты нотификации смены паспортных данных Интеграционные тесты при наличии оффера","Должен отображаться текст нотификации устаревшего паспорта в разделе профиля Персональные сведения","Должен отображаться текст нотификации устаревшего паспорта в разделе профиля Персональные сведения",""
"passed","Tue Dec 01 17:56:28 MSK 2020","Tue Dec 01 17:56:57 MSK 2020","29268","","Открытие накопительного счета - интеграционные тесты","","Открытие накопительного счета - интеграционные тесты","Открытие накопительного счета в рублях c 0 рублей","Открытие накопительного счета в рублях c 0 рублей",""
"failed","Tue Dec 01 17:44:59 MSK 2020","Tue Dec 01 17:45:26 MSK 2020","26714","","Переводы в другой банк организациям - интеграционные тесты","","Переводы в другой банк организациям - интеграционные тесты","Выгрузка квитанции на email со страницы успешного перевода В другой банк - Организациям","Выгрузка квитанции на email со страницы успешного перевода В другой банк - Организациям",""
"passed","Tue Dec 01 17:34:37 MSK 2020","Tue Dec 01 17:36:24 MSK 2020","106978","","Переводы по номеру счета клиенту банка - интеграционные тесты","","Переводы по номеру счета клиенту банка - интеграционные тесты","Выгрузка квитанции на email со страницы успешного перевода Клиенту ОТП-банка по номеру счета (с CASH-кредита)","Выгрузка квитанции на email со страницы успешного перевода Клиенту ОТП-банка по номеру счета (с CASH-кредита)",""
"passed","Tue Dec 01 18:26:59 MSK 2020","Tue Dec 01 18:27:15 MSK 2020","16746","","Витрина карт Обработка ошибки проверки дубликатов","","Витрина карт Обработка ошибки проверки дубликатов","Проверка активности кнопки Оформить карту при ошибке проверки дубликатов","Проверка активности кнопки Оформить карту при ошибке проверки дубликатов",""
"skipped","Tue Dec 01 18:30:27 MSK 2020","Tue Dec 01 18:30:27 MSK 2020","0","","Проверка карточек продуктов-призраков по Вкладам","","Проверка карточек продуктов-призраков по Вкладам","Отказ от предложения с выбором причины ""Мне не интересно""","Отказ от предложения с выбором причины ""Мне не интересно""",""
"passed","Tue Dec 01 18:13:50 MSK 2020","Tue Dec 01 18:15:16 MSK 2020","86633","","Изменение настроек уведомлений - интеграционные тесты","","Изменение настроек уведомлений - интеграционные тесты","Выключение уведомлений должно работать корректно","Выключение уведомлений должно работать корректно",""
"passed","Tue Dec 01 18:07:56 MSK 2020","Tue Dec 01 18:08:48 MSK 2020","52691","","Проведение переводов через продукт Сохранение продукта при переходе по закладкам в переводе","","Проведение переводов через продукт Сохранение продукта при переходе по закладкам в переводе","В другой банк","В другой банк",""
"failed","Tue Dec 01 17:19:34 MSK 2020","Tue Dec 01 17:19:40 MSK 2020","5993","","Переводы по номеру карты клиенту банка - интеграционные тесты","","Переводы по номеру карты клиенту банка - интеграционные тесты","Должна отображаться корректная ошибка при изменении номера карты","Должна отображаться корректная ошибка при изменении номера карты",""
"passed","Tue Dec 01 18:11:18 MSK 2020","Tue Dec 01 18:11:26 MSK 2020","8269","","Интеграционные тесты входа в приложение","","Интеграционные тесты входа в приложение","Ошибка при входе по логину/паролю - неверный логин, но верный пароль","Ошибка при входе по логину/паролю - неверный логин, но верный пароль",""
"passed","Tue Dec 01 18:12:24 MSK 2020","Tue Dec 01 18:13:50 MSK 2020","85402","","Изменение настроек уведомлений - интеграционные тесты","","Изменение настроек уведомлений - интеграционные тесты","Включение уведомлений должно работать корректно","Включение уведомлений должно работать корректно",""
